{"$schema":"https://json-schema.org/draft/2020-12/schema","additionalProperties":false,"properties":{"benchmark_input_sha256s":{"additionalProperties":false,"properties":{"corpus.jsonl":{"pattern":"^[0-9a-f]{64}$","type":"string"},"folds.json":{"pattern":"^[0-9a-f]{64}$","type":"string"},"queries.jsonl":{"pattern":"^[0-9a-f]{64}$","type":"string"}},"required":["corpus.jsonl","folds.json","queries.jsonl"],"type":"object"},"calibration_query_ids_sha256":{"pattern":"^[0-9a-f]{64}$","type":"string"},"error_budgets":{"additionalProperties":false,"properties":{"max_false_duplicate_rate":{"maximum":1,"minimum":0,"type":"number"},"max_false_internal_no_match_rate":{"maximum":1,"minimum":0,"type":"number"}},"required":["max_false_duplicate_rate","max_false_internal_no_match_rate"],"type":"object"},"heldout_query_ids_sha256":{"pattern":"^[0-9a-f]{64}$","type":"string"},"latency_target_ms_p95":{"exclusiveMinimum":0,"type":"number"},"policy_sha256":{"pattern":"^[0-9a-f]{64}$","type":"string"},"policy_version":{"const":"retrieval-policy-v1","type":"string"},"schema_version":{"const":1,"type":"integer"},"scope":{"enum":["synthetic_contract_only","production"],"type":"string"},"sealed_at":{"format":"date-time","type":"string"},"selected_depths":{"additionalProperties":false,"properties":{"comparator_cutoff":{"minimum":1,"type":"integer"},"final_lineage_count":{"minimum":1,"type":"integer"},"per_channel_depth":{"minimum":1,"type":"integer"}},"required":["comparator_cutoff","final_lineage_count","per_channel_depth"],"type":"object"},"selected_thresholds":{"additionalProperties":false,"properties":{"duplicate":{"maximum":1,"minimum":0,"type":"number"},"failure":{"maximum":1,"minimum":0,"type":"number"},"lineage":{"maximum":1,"minimum":0,"type":"number"}},"required":["duplicate","failure","lineage"],"type":"object"},"split_sha256":{"pattern":"^[0-9a-f]{64}$","type":"string"},"token_budget":{"minimum":1,"type":"integer"}},"required":["benchmark_input_sha256s","calibration_query_ids_sha256","error_budgets","heldout_query_ids_sha256","latency_target_ms_p95","policy_sha256","policy_version","schema_version","scope","sealed_at","selected_depths","selected_thresholds","split_sha256","token_budget"],"type":"object"}
