{"benchmark_input_sha256s":{"corpus.jsonl":"37ff8f5528b00e758823f7740a0bc76bef1b50246b3e33ae2a1b110fcfcfd3e0","folds.json":"72e1346d46e6e5221ccaf8fdb909a6632de09b56480a7ec28633537a1910421b","queries.jsonl":"bcbcc6fc3683f2951bb19058e946f577ed7030c1a69f164c6368fd6a78dc51b8"},"calibration_query_ids_sha256":"e72c7451bb220c45e540191dd74080f8c39ad3d28d4020df0a09cbd687f84731","error_budgets":{"max_false_duplicate_rate":0.05,"max_false_internal_no_match_rate":0.1},"heldout_query_ids_sha256":"9650f13c23fa5d594740deca8754486e10e5804078257697a6debd82a26a8a46","latency_target_ms_p95":200,"policy_sha256":"4d6a8375a4eba95291d27124291a8583fb8d53a31384823e314796750208bddd","policy_version":"retrieval-policy-v1","schema_version":1,"scope":"synthetic_contract_only","sealed_at":"2026-07-23T10:00:00Z","selected_depths":{"comparator_cutoff":10,"final_lineage_count":10,"per_channel_depth":50},"selected_thresholds":{"duplicate":0.8,"failure":0.8,"lineage":0.75},"split_sha256":"72e1346d46e6e5221ccaf8fdb909a6632de09b56480a7ec28633537a1910421b","token_budget":4096}
